===== Device: /dev/nvme0n1 =====
===== Date: Sun Jun 14 21:24:00 CST 2026 =====

--- SMART INFO (-a) ---
smartctl 7.1 2020-04-05 r5049 [x86_64-linux-4.18.0-425.19.2.4.g0fd3a169.el8.x86_64] (local build)
Copyright (C) 2002-19, Bruce Allen, Christian Franke, www.smartmontools.org

=== START OF INFORMATION SECTION ===
Model Number:                       INTEL SSDPF2KE032T9N
Serial Number:                      PHAB302400733P8EGN
Firmware Version:                   2CV10201
PCI Vendor/Subsystem ID:            0x8086
IEEE OUI Identifier:                0x5cd2e4
Total NVM Capacity:                 3,200,631,791,616 [3.20 TB]
Unallocated NVM Capacity:           0
Controller ID:                      0
Number of Namespaces:               128
Namespace 1 Size/Capacity:          3,200,631,791,616 [3.20 TB]
Namespace 1 Formatted LBA Size:     512
Namespace 1 IEEE EUI-64:            5cd2e4 93e22c0600
Local Time is:                      Sun Jun 14 21:24:00 2026 CST
Firmware Updates (0x18):            4 Slots, no Reset required
Optional Admin Commands (0x003f):   Security Format Frmw_DL NS_Mngmt Self_Test Directvs
Optional NVM Commands (0x004e):     Wr_Unc DS_Mngmt Wr_Zero Timestmp
Maximum Data Transfer Size:         32 Pages
Warning  Comp. Temp. Threshold:     70 Celsius
Critical Comp. Temp. Threshold:     80 Celsius

Supported Power States
St Op     Max   Active     Idle   RL RT WL WT  Ent_Lat  Ex_Lat
 0 +    18.00W       -        -    0  0  0  0        0       0
 1 +    14.00W       -        -    0  0  0  0        0       0
 2 +    10.00W       -        -    0  0  0  0        0       0

Supported LBA Sizes (NSID 0x1)
Id Fmt  Data  Metadt  Rel_Perf
 0 +     512       0         2
 1 -     512       8         2
 2 -    4096       0         2
 3 -    4096       8         2
 4 -    4096      64         2

=== START OF SMART DATA SECTION ===
SMART overall-health self-assessment test result: PASSED

SMART/Health Information (NVMe Log 0x02)
Critical Warning:                   0x00
Temperature:                        34 Celsius
Available Spare:                    100%
Available Spare Threshold:          10%
Percentage Used:                    0%
Data Units Read:                    16,174,242 [8.28 TB]
Data Units Written:                 43,812,221 [22.4 TB]
Host Read Commands:                 357,943,735
Host Write Commands:                1,569,616,186
Controller Busy Time:               10
Power Cycles:                       2
Power On Hours:                     574
Unsafe Shutdowns:                   0
Media and Data Integrity Errors:    0
Error Information Log Entries:      0
Warning  Comp. Temperature Time:    0
Critical Comp. Temperature Time:    0

Error Information (NVMe Log 0x01, max 64 entries)
No Errors Logged


--- HEALTH (-H) ---
smartctl 7.1 2020-04-05 r5049 [x86_64-linux-4.18.0-425.19.2.4.g0fd3a169.el8.x86_64] (local build)
Copyright (C) 2002-19, Bruce Allen, Christian Franke, www.smartmontools.org

=== START OF SMART DATA SECTION ===
SMART overall-health self-assessment test result: PASSED


--- ERROR LOG ---
smartctl 7.1 2020-04-05 r5049 [x86_64-linux-4.18.0-425.19.2.4.g0fd3a169.el8.x86_64] (local build)
Copyright (C) 2002-19, Bruce Allen, Christian Franke, www.smartmontools.org

=== START OF SMART DATA SECTION ===
Error Information (NVMe Log 0x01, max 64 entries)
No Errors Logged

