===== Device: /dev/nvme15n1 =====
===== Date: Thu May 28 13:05:34 CST 2026 =====

--- SMART INFO (-a) ---
smartctl 7.1 2020-04-05 r5049 [x86_64-linux-4.18.0-425.19.2.4.g0fd3a169.el8.x86_64] (local build)
Copyright (C) 2002-19, Bruce Allen, Christian Franke, www.smartmontools.org

=== START OF INFORMATION SECTION ===
Model Number:                       Dell Express Flash NVMe P4610 3.2TB SFF
Serial Number:                      BTLN905000UU3P2BGN
Firmware Version:                   VDV1DP21
PCI Vendor ID:                      0x8086
PCI Vendor Subsystem ID:            0x1028
IEEE OUI Identifier:                0x5cd2e4
Total NVM Capacity:                 3,200,000,000,000 [3.20 TB]
Unallocated NVM Capacity:           0
Controller ID:                      0
Number of Namespaces:               1
Namespace 1 Size/Capacity:          3,200,000,000,000 [3.20 TB]
Namespace 1 Formatted LBA Size:     512
Namespace 1 IEEE EUI-64:            5cd2e4 88cc3c0100
Local Time is:                      Thu May 28 13:05:34 2026 CST
Firmware Updates (0x02):            1 Slot
Optional Admin Commands (0x000e):   Format Frmw_DL NS_Mngmt
Optional NVM Commands (0x0006):     Wr_Unc DS_Mngmt
Maximum Data Transfer Size:         32 Pages
Warning  Comp. Temp. Threshold:     70 Celsius
Critical Comp. Temp. Threshold:     80 Celsius

Supported Power States
St Op     Max   Active     Idle   RL RT WL WT  Ent_Lat  Ex_Lat
 0 +    25.00W       -        -    0  0  0  0        0       0

Supported LBA Sizes (NSID 0x1)
Id Fmt  Data  Metadt  Rel_Perf
 0 +     512       0         2
 1 -    4096       0         0

=== START OF SMART DATA SECTION ===
SMART overall-health self-assessment test result: PASSED

SMART/Health Information (NVMe Log 0x02)
Critical Warning:                   0x00
Temperature:                        33 Celsius
Available Spare:                    99%
Available Spare Threshold:          10%
Percentage Used:                    0%
Data Units Read:                    66,422,131 [34.0 TB]
Data Units Written:                 415,031,108 [212 TB]
Host Read Commands:                 2,095,235,064
Host Write Commands:                24,827,876,531
Controller Busy Time:               613
Power Cycles:                       47
Power On Hours:                     12,607
Unsafe Shutdowns:                   43
Media and Data Integrity Errors:    0
Error Information Log Entries:      0
Warning  Comp. Temperature Time:    0
Critical Comp. Temperature Time:    0

Error Information (NVMe Log 0x01, max 64 entries)
No Errors Logged


--- HEALTH (-H) ---
smartctl 7.1 2020-04-05 r5049 [x86_64-linux-4.18.0-425.19.2.4.g0fd3a169.el8.x86_64] (local build)
Copyright (C) 2002-19, Bruce Allen, Christian Franke, www.smartmontools.org

=== START OF SMART DATA SECTION ===
SMART overall-health self-assessment test result: PASSED


--- ERROR LOG ---
smartctl 7.1 2020-04-05 r5049 [x86_64-linux-4.18.0-425.19.2.4.g0fd3a169.el8.x86_64] (local build)
Copyright (C) 2002-19, Bruce Allen, Christian Franke, www.smartmontools.org

=== START OF SMART DATA SECTION ===
Error Information (NVMe Log 0x01, max 64 entries)
No Errors Logged

