===== Device: /dev/nvme16n1 =====
===== Date: Wed May 27 23:02:50 CST 2026 =====

--- SMART INFO (-a) ---
smartctl 7.1 2020-04-05 r5049 [x86_64-linux-4.18.0-425.19.2.4.g0fd3a169.el8.x86_64] (local build)
Copyright (C) 2002-19, Bruce Allen, Christian Franke, www.smartmontools.org

=== START OF INFORMATION SECTION ===
Model Number:                       Dell Express Flash PM1725b 3.2TB SFF
Serial Number:                      S5CXNA0R100043
Firmware Version:                   1.2.1
PCI Vendor ID:                      0x144d
PCI Vendor Subsystem ID:            0x1028
IEEE OUI Identifier:                0x002538
Total NVM Capacity:                 3,200,631,791,616 [3.20 TB]
Unallocated NVM Capacity:           0
Controller ID:                      33
Number of Namespaces:               1
Namespace 1 Size/Capacity:          3,200,631,791,616 [3.20 TB]
Namespace 1 Formatted LBA Size:     512
Namespace 1 IEEE EUI-64:            002538 211100007c
Local Time is:                      Wed May 27 23:02:50 2026 CST
Firmware Updates (0x17):            3 Slots, Slot 1 R/O, no Reset required
Optional Admin Commands (0x0016):   Format Frmw_DL Self_Test
Optional NVM Commands (0x0036):     Wr_Unc DS_Mngmt Sav/Sel_Feat Resv
Maximum Data Transfer Size:         32 Pages
Warning  Comp. Temp. Threshold:     70 Celsius
Critical Comp. Temp. Threshold:     79 Celsius

Supported Power States
St Op     Max   Active     Idle   RL RT WL WT  Ent_Lat  Ex_Lat
 0 +    25.00W       -        -    0  0  0  0      100     100

Supported LBA Sizes (NSID 0x1)
Id Fmt  Data  Metadt  Rel_Perf
 0 -     512       0         1
 1 -     512       8         3
 2 -    4096       0         0
 3 -    4096       8         2

=== START OF SMART DATA SECTION ===
SMART overall-health self-assessment test result: PASSED

SMART/Health Information (NVMe Log 0x02)
Critical Warning:                   0x00
Temperature:                        27 Celsius
Available Spare:                    100%
Available Spare Threshold:          10%
Percentage Used:                    0%
Data Units Read:                    75,053,121 [38.4 TB]
Data Units Written:                 444,833,422 [227 TB]
Host Read Commands:                 2,296,528,361
Host Write Commands:                25,609,878,472
Controller Busy Time:               26,187
Power Cycles:                       53
Power On Hours:                     28,225
Unsafe Shutdowns:                   45
Media and Data Integrity Errors:    0
Error Information Log Entries:      0
Warning  Comp. Temperature Time:    0
Critical Comp. Temperature Time:    0
Temperature Sensor 1:               27 Celsius
Temperature Sensor 2:               27 Celsius
Temperature Sensor 3:               23 Celsius

Error Information (NVMe Log 0x01, max 64 entries)
No Errors Logged


--- HEALTH (-H) ---
smartctl 7.1 2020-04-05 r5049 [x86_64-linux-4.18.0-425.19.2.4.g0fd3a169.el8.x86_64] (local build)
Copyright (C) 2002-19, Bruce Allen, Christian Franke, www.smartmontools.org

=== START OF SMART DATA SECTION ===
SMART overall-health self-assessment test result: PASSED


--- ERROR LOG ---
smartctl 7.1 2020-04-05 r5049 [x86_64-linux-4.18.0-425.19.2.4.g0fd3a169.el8.x86_64] (local build)
Copyright (C) 2002-19, Bruce Allen, Christian Franke, www.smartmontools.org

=== START OF SMART DATA SECTION ===
Error Information (NVMe Log 0x01, max 64 entries)
No Errors Logged

