===== Device: /dev/nvme6n1 =====
===== Date: Thu May 28 13:05:08 CST 2026 =====

--- SMART INFO (-a) ---
smartctl 7.1 2020-04-05 r5049 [x86_64-linux-4.18.0-425.19.2.4.g0fd3a169.el8.x86_64] (local build)
Copyright (C) 2002-19, Bruce Allen, Christian Franke, www.smartmontools.org

=== START OF INFORMATION SECTION ===
Model Number:                       Dell Express Flash NVMe SM1715 3.2TB SFF
Serial Number:                      S294NYAG200087
Firmware Version:                   IPV0AD3Q
PCI Vendor ID:                      0x144d
PCI Vendor Subsystem ID:            0x1028
IEEE OUI Identifier:                0x002538
Controller ID:                      0
Number of Namespaces:               1
Namespace 1 Size/Capacity:          3,200,631,791,616 [3.20 TB]
Namespace 1 Utilization:            3,181,070,049,280 [3.18 TB]
Namespace 1 Formatted LBA Size:     512
Local Time is:                      Thu May 28 13:05:08 2026 CST
Firmware Updates (0x07):            3 Slots, Slot 1 R/O
Optional Admin Commands (0x0006):   Format Frmw_DL
Optional NVM Commands (0x0006):     Wr_Unc DS_Mngmt

Supported Power States
St Op     Max   Active     Idle   RL RT WL WT  Ent_Lat  Ex_Lat
 0 +    25.00W       -        -    0  0  0  0      100     100

Supported LBA Sizes (NSID 0x1)
Id Fmt  Data  Metadt  Rel_Perf
 0 -     512       0         2
 1 -     512       8         3
 2 -    4096       0         0
 3 -    4096       8         1

=== START OF SMART DATA SECTION ===
SMART overall-health self-assessment test result: PASSED

SMART/Health Information (NVMe Log 0x02)
Critical Warning:                   0x00
Temperature:                        32 Celsius
Available Spare:                    78%
Available Spare Threshold:          10%
Percentage Used:                    0%
Data Units Read:                    794,185,854 [406 TB]
Data Units Written:                 1,689,589,717 [865 TB]
Host Read Commands:                 143,924,471,315
Host Write Commands:                27,942,102,211
Controller Busy Time:               0
Power Cycles:                       86
Power On Hours:                     61,923
Unsafe Shutdowns:                   15
Media and Data Integrity Errors:    0
Error Information Log Entries:      0

Error Information (NVMe Log 0x01, max 64 entries)
No Errors Logged


--- HEALTH (-H) ---
smartctl 7.1 2020-04-05 r5049 [x86_64-linux-4.18.0-425.19.2.4.g0fd3a169.el8.x86_64] (local build)
Copyright (C) 2002-19, Bruce Allen, Christian Franke, www.smartmontools.org

=== START OF SMART DATA SECTION ===
SMART overall-health self-assessment test result: PASSED


--- ERROR LOG ---
smartctl 7.1 2020-04-05 r5049 [x86_64-linux-4.18.0-425.19.2.4.g0fd3a169.el8.x86_64] (local build)
Copyright (C) 2002-19, Bruce Allen, Christian Franke, www.smartmontools.org

=== START OF SMART DATA SECTION ===
Error Information (NVMe Log 0x01, max 64 entries)
No Errors Logged

