===== Device: /dev/nvme9n1 =====
===== Date: Wed May 27 23:03:11 CST 2026 =====

--- SMART INFO (-a) ---
smartctl 7.1 2020-04-05 r5049 [x86_64-linux-4.18.0-425.19.2.4.g0fd3a169.el8.x86_64] (local build)
Copyright (C) 2002-19, Bruce Allen, Christian Franke, www.smartmontools.org

=== START OF INFORMATION SECTION ===
Model Number:                       Dell Express Flash NVMe P4610 3.2TB SFF
Serial Number:                      BTLN905000R83P2BGN
Firmware Version:                   VDV1DP21
PCI Vendor ID:                      0x8086
PCI Vendor Subsystem ID:            0x1028
IEEE OUI Identifier:                0x5cd2e4
Total NVM Capacity:                 3,200,000,000,000 [3.20 TB]
Unallocated NVM Capacity:           0
Controller ID:                      0
Number of Namespaces:               1
Namespace 1 Size/Capacity:          3,200,000,000,000 [3.20 TB]
Namespace 1 Formatted LBA Size:     512
Namespace 1 IEEE EUI-64:            5cd2e4 1bcc3c0100
Local Time is:                      Wed May 27 23:03:11 2026 CST
Firmware Updates (0x02):            1 Slot
Optional Admin Commands (0x000e):   Format Frmw_DL NS_Mngmt
Optional NVM Commands (0x0006):     Wr_Unc DS_Mngmt
Maximum Data Transfer Size:         32 Pages
Warning  Comp. Temp. Threshold:     70 Celsius
Critical Comp. Temp. Threshold:     80 Celsius

Supported Power States
St Op     Max   Active     Idle   RL RT WL WT  Ent_Lat  Ex_Lat
 0 +    25.00W       -        -    0  0  0  0        0       0

Supported LBA Sizes (NSID 0x1)
Id Fmt  Data  Metadt  Rel_Perf
 0 +     512       0         2
 1 -    4096       0         0

=== START OF SMART DATA SECTION ===
SMART overall-health self-assessment test result: PASSED

SMART/Health Information (NVMe Log 0x02)
Critical Warning:                   0x00
Temperature:                        31 Celsius
Available Spare:                    100%
Available Spare Threshold:          10%
Percentage Used:                    0%
Data Units Read:                    58,026,711 [29.7 TB]
Data Units Written:                 329,799,887 [168 TB]
Host Read Commands:                 1,834,962,165
Host Write Commands:                18,907,376,586
Controller Busy Time:               476
Power Cycles:                       46
Power On Hours:                     12,593
Unsafe Shutdowns:                   2
Media and Data Integrity Errors:    0
Error Information Log Entries:      0
Warning  Comp. Temperature Time:    0
Critical Comp. Temperature Time:    0

Error Information (NVMe Log 0x01, max 64 entries)
No Errors Logged


--- HEALTH (-H) ---
smartctl 7.1 2020-04-05 r5049 [x86_64-linux-4.18.0-425.19.2.4.g0fd3a169.el8.x86_64] (local build)
Copyright (C) 2002-19, Bruce Allen, Christian Franke, www.smartmontools.org

=== START OF SMART DATA SECTION ===
SMART overall-health self-assessment test result: PASSED


--- ERROR LOG ---
smartctl 7.1 2020-04-05 r5049 [x86_64-linux-4.18.0-425.19.2.4.g0fd3a169.el8.x86_64] (local build)
Copyright (C) 2002-19, Bruce Allen, Christian Franke, www.smartmontools.org

=== START OF SMART DATA SECTION ===
Error Information (NVMe Log 0x01, max 64 entries)
No Errors Logged

